{
  "$schema": "../app_id/datastores.schema.json",
  "postgres": {
    "provider": "neon",
    "orm": "drizzle",
    "migrations_dir": "drizzle/",
    "rls": "fail_closed",
    "tenancy": "multi_org",
    "url_ref": "DATABASE_URL",
    "scope": "fresh",
    "sslmode": "require",
    "admin_url_ref": "DATABASE_URL_UNPOOLED",
    "pooling": "transaction",
    "rls_verified": {
      "at": "2026-09-22T07:06:06+00:00",
      "backend": "neon",
      "mode": "fail_closed",
      "source": "provision.py --verify-rls",
      "role": "app_rw",
      "superuser": false,
      "bypassrls": false,
      "org_scoped_tables": 55,
      "protected": 55,
      "unprotected": [],
      "open_policies": [],
      "leaking_policies": [],
      "policies_executed": 55,
      "policies_unverified": [],
      "unmeasured": [],
      "probe_table": "account_summaries",
      "probe_tables": 43,
      "probe_skipped": [
        "customer_stakeholders:foreign keys",
        "deployments:foreign keys",
        "implementation:foreign keys",
        "interactions:foreign keys",
        "internal_staff:foreign keys",
        "org_invites:control plane (readable with no workspace in scope, by design)",
        "org_members:control plane (readable with no workspace in scope, by design)",
        "orgs:control plane (readable with no workspace in scope, by design)",
        "platform:foreign keys",
        "solutions:foreign keys",
        "task_workflow_instances:foreign keys",
        "tickets:foreign keys"
      ],
      "foreign_rows_readable": 0,
      "leaking_tables": [],
      "cross_org_write": "42501",
      "cross_org_writable": [],
      "unset_org_rows": 0,
      "open_with_no_org": [],
      "running_app": "enforced",
      "running_app_detail": "SELECT 1 ok \u00b7 role app_rw (RLS enforced)"
    }
  },
  "blob": {
    "provider": "vercel_blob",
    "root_prefix": "orgs/onfinance-ai",
    "token_ref": "BLOB_READ_WRITE_TOKEN"
  },
  "cache": {
    "provider": "none"
  },
  "memory": {
    "backend": "postgres"
  }
}
